{
  "id": "note-page-07",
  "target": { "type": "path", "path": "content/main.md" },
  "kind": "comment",
  "status": "open",
  "body": "Page 7 annotation: risk review notes should stay separate from measured table values.",
  "author": "codex",
  "created": "2026-05-19T00:00:00Z",
  "labels": ["page-07", "review"]
}
