{
  "id": "note-page-01",
  "target": { "type": "path", "path": "content/main.md" },
  "kind": "comment",
  "status": "open",
  "body": "Page 1 annotation: confirm the baseline signal score before downstream comparisons.",
  "author": "codex",
  "created": "2026-05-19T00:00:00Z",
  "labels": ["page-01", "review"]
}
